{
  "$schema": "https://design.edgecom.ai/schemas/tokens.schema.json",
  "version": "v3.0.0",
  "digest": "d3f22b364a476fda",
  "source": "src/app/globals.css",
  "generator": "scripts/gen-tokens.mjs",
  "counts": {
    "total": 122,
    "modeIndependent": 61,
    "withDarkOverride": 61,
    "restatedInDark": 9,
    "aliases": 21,
    "tailwindExposed": 97,
    "byFamily": {
      "typography": 3,
      "surface": 8,
      "brand": 5,
      "neutral": 10,
      "status": 19,
      "interaction": 5,
      "relative-surface": 3,
      "chart": 35,
      "legacy": 25,
      "radius": 1,
      "other": 1,
      "sidebar": 7
    }
  },
  "tokens": [
    {
      "id": "primary",
      "cssVar": "--primary",
      "family": "brand",
      "type": "color",
      "light": "oklch(0.514 0.161 254.3)",
      "dark": "oklch(0.514 0.161 254.3)",
      "modeIndependent": true,
      "restatedInDark": true,
      "aliasOf": null,
      "tailwindUtility": true
    },
    {
      "id": "primary-emphasis",
      "cssVar": "--primary-emphasis",
      "family": "brand",
      "type": "color",
      "light": "oklch(0.5 0.161 254.3)",
      "dark": "oklch(0.72 0.14 254)",
      "modeIndependent": false,
      "restatedInDark": false,
      "aliasOf": null,
      "tailwindUtility": true
    },
    {
      "id": "primary-foreground",
      "cssVar": "--primary-foreground",
      "family": "brand",
      "type": "color",
      "light": "oklch(0.985 0 0)",
      "dark": "oklch(0.985 0 0)",
      "modeIndependent": true,
      "restatedInDark": true,
      "aliasOf": null,
      "tailwindUtility": true
    },
    {
      "id": "primary-subtle",
      "cssVar": "--primary-subtle",
      "family": "brand",
      "type": "color",
      "light": "oklch(0.965 0.025 254)",
      "dark": "oklch(0.22 0.05 254)",
      "modeIndependent": false,
      "restatedInDark": false,
      "aliasOf": null,
      "tailwindUtility": true
    },
    {
      "id": "primary-subtle-foreground",
      "cssVar": "--primary-subtle-foreground",
      "family": "brand",
      "type": "color",
      "light": "var(--primary-emphasis)",
      "dark": "var(--primary-emphasis)",
      "modeIndependent": true,
      "restatedInDark": true,
      "aliasOf": "primary-emphasis",
      "tailwindUtility": true
    },
    {
      "id": "chart-1",
      "cssVar": "--chart-1",
      "family": "chart",
      "type": "color",
      "light": "var(--chart-electricity-500)",
      "dark": null,
      "modeIndependent": true,
      "restatedInDark": false,
      "aliasOf": "chart-electricity-500",
      "tailwindUtility": true
    },
    {
      "id": "chart-2",
      "cssVar": "--chart-2",
      "family": "chart",
      "type": "color",
      "light": "var(--chart-water-500)",
      "dark": null,
      "modeIndependent": true,
      "restatedInDark": false,
      "aliasOf": "chart-water-500",
      "tailwindUtility": true
    },
    {
      "id": "chart-3",
      "cssVar": "--chart-3",
      "family": "chart",
      "type": "color",
      "light": "var(--chart-gas-500)",
      "dark": null,
      "modeIndependent": true,
      "restatedInDark": false,
      "aliasOf": "chart-gas-500",
      "tailwindUtility": true
    },
    {
      "id": "chart-4",
      "cssVar": "--chart-4",
      "family": "chart",
      "type": "color",
      "light": "var(--chart-temperature-500)",
      "dark": null,
      "modeIndependent": true,
      "restatedInDark": false,
      "aliasOf": "chart-temperature-500",
      "tailwindUtility": true
    },
    {
      "id": "chart-5",
      "cssVar": "--chart-5",
      "family": "chart",
      "type": "color",
      "light": "var(--chart-emissions-500)",
      "dark": null,
      "modeIndependent": true,
      "restatedInDark": false,
      "aliasOf": "chart-emissions-500",
      "tailwindUtility": true
    },
    {
      "id": "chart-electricity-100",
      "cssVar": "--chart-electricity-100",
      "family": "chart",
      "type": "color",
      "light": "oklch(0.94 0.05 75)",
      "dark": null,
      "modeIndependent": true,
      "restatedInDark": false,
      "aliasOf": null,
      "tailwindUtility": true
    },
    {
      "id": "chart-electricity-300",
      "cssVar": "--chart-electricity-300",
      "family": "chart",
      "type": "color",
      "light": "oklch(0.86 0.11 75)",
      "dark": null,
      "modeIndependent": true,
      "restatedInDark": false,
      "aliasOf": null,
      "tailwindUtility": true
    },
    {
      "id": "chart-electricity-500",
      "cssVar": "--chart-electricity-500",
      "family": "chart",
      "type": "color",
      "light": "oklch(0.75 0.15 75)",
      "dark": null,
      "modeIndependent": true,
      "restatedInDark": false,
      "aliasOf": null,
      "tailwindUtility": true
    },
    {
      "id": "chart-electricity-700",
      "cssVar": "--chart-electricity-700",
      "family": "chart",
      "type": "color",
      "light": "oklch(0.6 0.13 75)",
      "dark": null,
      "modeIndependent": true,
      "restatedInDark": false,
      "aliasOf": null,
      "tailwindUtility": true
    },
    {
      "id": "chart-electricity-900",
      "cssVar": "--chart-electricity-900",
      "family": "chart",
      "type": "color",
      "light": "oklch(0.45 0.09 75)",
      "dark": null,
      "modeIndependent": true,
      "restatedInDark": false,
      "aliasOf": null,
      "tailwindUtility": true
    },
    {
      "id": "chart-emissions-100",
      "cssVar": "--chart-emissions-100",
      "family": "chart",
      "type": "color",
      "light": "oklch(0.94 0.045 10)",
      "dark": null,
      "modeIndependent": true,
      "restatedInDark": false,
      "aliasOf": null,
      "tailwindUtility": true
    },
    {
      "id": "chart-emissions-300",
      "cssVar": "--chart-emissions-300",
      "family": "chart",
      "type": "color",
      "light": "oklch(0.8 0.12 10)",
      "dark": null,
      "modeIndependent": true,
      "restatedInDark": false,
      "aliasOf": null,
      "tailwindUtility": true
    },
    {
      "id": "chart-emissions-500",
      "cssVar": "--chart-emissions-500",
      "family": "chart",
      "type": "color",
      "light": "oklch(0.58 0.16 10)",
      "dark": null,
      "modeIndependent": true,
      "restatedInDark": false,
      "aliasOf": null,
      "tailwindUtility": true
    },
    {
      "id": "chart-emissions-700",
      "cssVar": "--chart-emissions-700",
      "family": "chart",
      "type": "color",
      "light": "oklch(0.47 0.14 10)",
      "dark": null,
      "modeIndependent": true,
      "restatedInDark": false,
      "aliasOf": null,
      "tailwindUtility": true
    },
    {
      "id": "chart-emissions-900",
      "cssVar": "--chart-emissions-900",
      "family": "chart",
      "type": "color",
      "light": "oklch(0.35 0.11 10)",
      "dark": null,
      "modeIndependent": true,
      "restatedInDark": false,
      "aliasOf": null,
      "tailwindUtility": true
    },
    {
      "id": "chart-gas-100",
      "cssVar": "--chart-gas-100",
      "family": "chart",
      "type": "color",
      "light": "oklch(0.93 0.04 25)",
      "dark": null,
      "modeIndependent": true,
      "restatedInDark": false,
      "aliasOf": null,
      "tailwindUtility": true
    },
    {
      "id": "chart-gas-300",
      "cssVar": "--chart-gas-300",
      "family": "chart",
      "type": "color",
      "light": "oklch(0.82 0.1 25)",
      "dark": null,
      "modeIndependent": true,
      "restatedInDark": false,
      "aliasOf": null,
      "tailwindUtility": true
    },
    {
      "id": "chart-gas-500",
      "cssVar": "--chart-gas-500",
      "family": "chart",
      "type": "color",
      "light": "oklch(0.62 0.2 25)",
      "dark": null,
      "modeIndependent": true,
      "restatedInDark": false,
      "aliasOf": null,
      "tailwindUtility": true
    },
    {
      "id": "chart-gas-700",
      "cssVar": "--chart-gas-700",
      "family": "chart",
      "type": "color",
      "light": "oklch(0.5 0.18 25)",
      "dark": null,
      "modeIndependent": true,
      "restatedInDark": false,
      "aliasOf": null,
      "tailwindUtility": true
    },
    {
      "id": "chart-gas-900",
      "cssVar": "--chart-gas-900",
      "family": "chart",
      "type": "color",
      "light": "oklch(0.4 0.13 25)",
      "dark": null,
      "modeIndependent": true,
      "restatedInDark": false,
      "aliasOf": null,
      "tailwindUtility": true
    },
    {
      "id": "chart-misc-100",
      "cssVar": "--chart-misc-100",
      "family": "chart",
      "type": "color",
      "light": "oklch(0.93 0.05 300)",
      "dark": null,
      "modeIndependent": true,
      "restatedInDark": false,
      "aliasOf": null,
      "tailwindUtility": true
    },
    {
      "id": "chart-misc-300",
      "cssVar": "--chart-misc-300",
      "family": "chart",
      "type": "color",
      "light": "oklch(0.82 0.11 300)",
      "dark": null,
      "modeIndependent": true,
      "restatedInDark": false,
      "aliasOf": null,
      "tailwindUtility": true
    },
    {
      "id": "chart-misc-500",
      "cssVar": "--chart-misc-500",
      "family": "chart",
      "type": "color",
      "light": "oklch(0.55 0.18 300)",
      "dark": null,
      "modeIndependent": true,
      "restatedInDark": false,
      "aliasOf": null,
      "tailwindUtility": true
    },
    {
      "id": "chart-misc-700",
      "cssVar": "--chart-misc-700",
      "family": "chart",
      "type": "color",
      "light": "oklch(0.45 0.16 300)",
      "dark": null,
      "modeIndependent": true,
      "restatedInDark": false,
      "aliasOf": null,
      "tailwindUtility": true
    },
    {
      "id": "chart-misc-900",
      "cssVar": "--chart-misc-900",
      "family": "chart",
      "type": "color",
      "light": "oklch(0.35 0.12 300)",
      "dark": null,
      "modeIndependent": true,
      "restatedInDark": false,
      "aliasOf": null,
      "tailwindUtility": true
    },
    {
      "id": "chart-temperature-100",